username,ristorante,stelle,testo,data,risposta
Utente,Villa Crespi,3,"Ho festeggiato il mio compleanno qui e non potevo scegliere posto migliore. Personale gentilissimo, cibo squisito e un'atmosfera magica. Grazie di tutto!",2025-09-02 00:30:54,"Ci fa molto piacere leggere le sue parole! La soddisfazione dei nostri clienti è la nostra priorità. L'aspettiamo per un'altra esperienza indimenticabile."
Utente1,Villa Crespi,3,"Il cibo era buono, ma i prezzi sono un po' alti per le porzioni offerte. Il personale è stato un po' distratto, ma nel complesso una serata discreta.",2025-08-26,"Grazie per il suo feedback. Prendiamo nota delle sue osservazioni sui prezzi e sul servizio. Il nostro obiettivo è offrire un'esperienza di alta qualità e il suo parere ci aiuta a migliorare."
Utente2,Villa Crespi,5,"Tutto perfetto, dall'antipasto al dolce. La tartare di lavarello era deliziosa e la cantina dei vini ha una selezione eccellente. Consigliatissimo!",2025-08-25,"Siamo lieti che abbia apprezzato ogni aspetto della sua cena. La passione per il nostro lavoro si riflette in ogni piatto che serviamo. La ringraziamo e a presto!"
Utente3,Villa Crespi,2,"Sono rimasto un po' deluso. Il piatto di gnocchi era troppo salato e l'attesa per l'ordinazione è stata eccessiva. Forse una serata storta, ma non credo di tornarci.",2025-08-23,"Ci dispiace molto per la sua esperienza negativa. Ci scusiamo per gli inconvenienti riscontrati. Se volesse darci una seconda possibilità, saremmo felici di farle cambiare idea."
Utente4,Villa Crespi,4,"Bel posto, ideale per una cena romantica. I piatti sono ben presentati e gustosi. Il servizio è stato attento e puntuale. Una bella scoperta.",2025-08-22,"Grazie! Ci fa piacere sapere che siamo il luogo ideale per le sue occasioni speciali. Speriamo di ospitarla di nuovo per la sua prossima cena romantica."
Utente,George Restaurant,5,"Molto Carino",2025-09-02 00:29:20,""
